<?xml version="1.0" encoding="euc-kr"?>
<!DOCTYPE maf-command PUBLIC
         "-//Miranet//DTD maf-command config XML V1.0//EN"
         "mvc-configuration.dtd">
<configuration>
	<template-list></template-list>

	<global-view></global-view>
	<action title="SiteMap" uri="SiteMap.do" type="modules.common.actions.SiteMap">
		<action-view>
			<view-info name="default" uri="/WEB-INF/jsp/sitemap/sitemap.jsp" />
		</action-view>
	</action>
	<action title="우편번호 검색" uri="Zipcode.do" type="miraenet.app.zipcode.actions.Zipcode">
		<action-view>
			<view-info name="default" uri="/WEB-INF/jsp/mafapp/zipcode/zipcode.jsp" />
		</action-view>
	</action>
</configuration>