<?xml version="1.0" encoding="utf-8" ?>
<!DOCTYPE maf-resource PUBLIC
         "-//Miranet//DTD maf-command config XML V1.0//EN"
         "mvc-configuration.dtd">
<configuration>
	<global-view></global-view>
	<action uri="bank.do" type="modules.survey.admin.BankManagerAction" desc="설문은행관리" default="list">
		<action-view>
			<view-info name="list" uri="/WEB-INF/jsp/survey/admin/bankmanager/list.jsp" useTemplate="www" />
			<view-info name="edit" uri="/WEB-INF/jsp/survey/admin/bankmanager/edit.jsp" useTemplate="www" />
			<view-info name="add" uri="/WEB-INF/jsp/survey/admin/bankmanager/add.jsp" useTemplate="www" />
			<view-info name="editLang" uri="/WEB-INF/jsp/survey/admin/bankmanager/editLang.jsp" useTemplate="www" />
		</action-view>
		<cmds>
			<cmd name="list" method="cmdList" formname="frm1" authtype="R" />
			<cmd name="edit" method="cmdEdit" formname="frm1" authtype="U" />
			<cmd name="update" method="cmdUpdate" formname="frm1" from="edit" authtype="U" />
			<cmd name="insert" method="cmdInsert" formname="frm1" from="update" authtype="C" />
			<cmd name="add" method="cmdAdd" formname="frm1" from="update" authtype="C" />
			<cmd name="delete" method="cmdDelete" formname="frm1" from="delete" authtype="D" />
			<cmd name="editLang" method="cmdEditLang" formname="frm1" authtype="U" />
		</cmds>
		<forms>
			<form name="frm1" bundle="table.survey_bank">
				<input name="queid" message="queid" type="text" required="true" />
				<input name="qweowner" message="qweowner" type="text" required="true" />
				<input name="quetitle" message="quetitle" type="text" />
				<input name="quecount" message="quecount" type="text" />
				<input name="quetype" message="quetype" type="text" required="true" />
				<input name="update_dt" bundle="table._common" message="field.update_dt" type="text" />
				<input name="active_yn" bundle="common" message="select.active" type="text" />
			</form>
		</forms>
	</action>
	
	<action uri="setmanager.do" type="modules.survey.admin.SetManagerAction" desc="설문 Set 관리" default="list">
		<action-view>
			<view-info name="list" uri="/WEB-INF/jsp/survey/admin/setmanager/list.jsp" useTemplate="www" />
			<view-info name="view" uri="/WEB-INF/jsp/survey/admin/setmanager/view.jsp" useTemplate="www" />
			<view-info name="edit" uri="/WEB-INF/jsp/survey/admin/setmanager/edit.jsp" useTemplate="www" />
			<view-info name="add" uri="/WEB-INF/jsp/survey/admin/setmanager/add.jsp" useTemplate="www" />
		</action-view>
		<cmds>
			<cmd name="list" method="cmdList" formname="frm1" authtype="R" />
			<cmd name="view" method="cmdView" formname="frm1" authtype="R" />
			<cmd name="edit" method="cmdEdit" formname="frm1" authtype="U" />
			<cmd name="update" method="cmdUpdate" formname="frm1" from="edit" authtype="U" />
			<cmd name="updateItems" method="cmdUpdateItems" formname="frm1" from="edit" authtype="U" />
			<cmd name="insert" method="cmdInsert" formname="frm1" from="update" authtype="C" />
			<cmd name="add" method="cmdAdd" formname="frm1" from="update" authtype="C" />
			<cmd name="delete" method="cmdDelete" formname="frm1" from="delete" authtype="D" />
			
		</cmds>
		<forms>
			<form name="frm1" bundle="table.survey_set">
				<input name="setid" message="setid" type="text" required="true" />
				<input name="setowner" message="setowner" type="text" required="true" />
				<input name="settitle" message="settitle" type="text" />
				<input name="surveytype" message="surveytype" bundle="table.survey_mst" type="text" />
				<input name="setdesc" message="setdesc" type="text" />
				<input name="reg_usn" bundle="table._common" message="field.reg_usn" type="text" />
				<input name="reg_dt" bundle="table._common" message="field.reg_dt" type="text" />
				<input name="update_dt" bundle="table._common" message="field.update_dt" type="text" />
				<input name="update_usn" bundle="table._common" message="field.update_usn" type="text" />
				<input name="active_yn" bundle="common" message="select.use" type="text" required="true" />
				<input name="queid" message="queid" bundle="table.exm_bank" type="text" />
				<input name="quetitle" message="quetitle" bundle="table.exm_bank" type="text" />
			</form>
		</forms>
	</action>
	
	<action uri="surveymanager.do" type="modules.survey.admin.SurveyManagerAction" desc="설문관리"
		default="list" jsppath="/WEB-INF/jsp/survey/admin/surveymanager/">
		<action-view>
			<view-info name="list" uri="list.jsp" useTemplate="www" />
			<view-info name="view" uri="view.jsp" useTemplate="www" />
			<view-info name="edit" uri="edit.jsp" useTemplate="www" />
			<view-info name="add" uri="add.jsp" useTemplate="www" />
			<view-info name="excel" uri="excel.jsp" />
		</action-view>
		<cmds>
			<cmd name="list" method="cmdList" formname="frm1" authtype="R" />
			<cmd name="view" method="cmdView" formname="frm1" authtype="R" />
			<cmd name="edit" method="cmdEdit" formname="frm1" authtype="U" />
			<cmd name="update" method="cmdUpdate" formname="frm1" from="edit" authtype="U" />
			<cmd name="insert" method="cmdInsert" formname="frm1" from="update" authtype="C" />
			<cmd name="add" method="cmdAdd" formname="frm1" from="update" authtype="C" />
			<cmd name="delete" method="cmdDelete" formname="frm1" from="delete" authtype="D" />
			<cmd name="excel" method="cmdExcel" formname="frm1" authtype="R" />
		</cmds>
		<forms>
			<form name="frm1" bundle="table.survey_mst">
				<input name="surveyid" message="surveyid" type="text" required="true" />
				<input name="surveyowner" message="surveyowner" type="text" required="true" />
				<input name="surveytitle" message="surveytitle" type="text" />
				<input name="surveydesc" message="surveydesc" type="text" />
				<input name="survey_sdat_t1" message="survey_sdat_t1" type="text" />
				<input name="survey_edat_t1" message="survey_edat_t1" type="text" />
				<input name="surveytype" message="surveytype" type="text" />
				<input name="region" message="region" type="text" bundle="table.bas_org" />
				<input name="org_type" message="org_type" type="text" bundle="table.bas_org" />
				<input name="userid" message="userid" type="text" bundle="table.maf_user" />
				<input name="nm" message="nm" type="text" bundle="table.maf_user" />
				<input name="org_name" message="org_name" type="text" bundle="table.bas_org" />
				<input name="setid" message="setid" type="text" bundle="table.survey_set" />
				<input name="setowner" message="setowner" type="text" bundle="table.survey_set" />
				<input name="settitle" message="settitle" type="text" bundle="table.survey_set" />
				<input name="reg_usn" bundle="table._common" message="field.reg_usn" type="text" />
				<input name="reg_dt" bundle="table._common" message="field.reg_dt" type="text" />
				<input name="update_dt" bundle="table._common" message="field.update_dt" type="text" />
				<input name="update_usn" bundle="table._common" message="field.update_usn" type="text" />
				<input name="active_yn" bundle="common" message="select.use" type="text" required="true" />
			</form>
		</forms>
	</action>
	
	<action uri="setchoose.do" type="modules.survey.admin.SetChooseAction" desc="설문 Set 선택" title="설문 Set 선택" default="list"
		jsppath="/WEB-INF/jsp/survey/admin/setchoose/">
		<action-view>
			<view-info name="list" uri="list.jsp" useTemplate="popup" />
			<view-info name="view" uri="view.jsp" useTemplate="popup" />
		</action-view>
		<cmds>
			<cmd name="list" method="cmdList" formname="frm1" authtype="R" />
			<cmd name="view" method="cmdView" formname="frm1" authtype="R" />
		</cmds>
		<forms>
			<form name="frm1" bundle="table.exm_set">
				<input name="setid" message="setid" type="text" required="true" />
				<input name="setowner" message="setowner" type="text" required="true" />
				<input name="settitle" message="settitle" type="text" />
				<input name="exmtype" message="exmtype" bundle="table.exm_mst" type="text" />
				<input name="setdesc" message="setdesc" type="text" />
				<input name="exmtime" message="exmtime" type="text" />
				<input name="reg_usn" bundle="table._common" message="field.reg_usn" type="text" />
				<input name="reg_dt" bundle="table._common" message="field.reg_dt" type="text" />
				<input name="update_dt" bundle="table._common" message="field.update_dt" type="text" />
				<input name="update_usn" bundle="table._common" message="field.update_usn" type="text" />
				<input name="active_yn" bundle="common" message="select.use" type="text" required="true" />
				<input name="queid" message="queid" bundle="table.exm_bank" type="text" />
				<input name="quetitle" message="quetitle" bundle="table.exm_bank" type="text" />
				<input name="quescore" message="quescore" bundle="table.exm_bank" type="text" />
				<input name="quelevel" message="quelevel" bundle="table.exm_bank" type="text" required="true" />
				<input name="cat_name" bundle="table.exm_category" message="cat_name" />
			</form>
		</forms>
	</action>
</configuration>
